<?xml version="1.0" encoding="UTF-8"?>
<!DOCTYPE operator SYSTEM "ophidiaoperator.dtd">
<operator name="OPH_MOVECONTAINER" version="1.0">
    <info>
        <abstract>[Type]
Data Process.

[Behaviour]
It moves/renames a visible container.

[Parameters]
- container : exactly 2 paths (separated by |) for the input and the output containers (with this ordering) must be specified.
                    Paths can be relative to the cwd or absolute.
                    In case of moving operation without renaming, it is necessary to re-specify
                    the name of the input container.
- cwd : absolute path corresponding to the current working directory.
        The user can operate only within his folders/containers.

[System parameters]    
- exec_mode : operator execution mode. Possible values are async (default) for
              asynchronous mode, sync for synchronous mode with json-compliant output.
- ncores : number of parallel processes to be used (min. 1).
           This operator is not parallel, so the only possible value is 1.
- sessionid : session identifier used server-side to manage sessions and jobs.
              Usually users don't need to use/modify it, except when it is necessary
              to create a new session or switch to another one.
- objkey_filter : filter on the output of the operator written to file (default=all => no filter, none => no output).
                  movecontainer : no output.
        
[Examples]       
Move and rename the visible container &quot;container1&quot; from &quot;/session-code1/folder1&quot; to &quot;/session-code1/folder1/folder2/container2&quot;:
OPH_TERM: oph_movecontainer container=folder1/container1|folder1/folder2/container2;cwd=/session-code1;
SUBMISSION STRING: &quot;operator=oph_movecontainer;container=folder1/container1|folder1/folder2/container2;cwd=/session-code1;&quot;</abstract>
        <author>CMCC Foundation</author>
        <category>Virtual File System</category>
        <creationdate>27/07/2013</creationdate>
        <license url="http://www.gnu.org/licenses/gpl.txt">GPLv3</license>
        <permission>write</permission>
    </info>
    <args>
		<argument type="string" mandatory="yes">container</argument>
		<argument type="string" mandatory="yes">cwd</argument>
		<argument type="string" mandatory="no" default="async" values="async|sync">exec_mode</argument>
		<argument type="string" mandatory="no" default="null">sessionid</argument>
		<argument type="int" mandatory="no" default="1" minvalue="1" maxvalue="1">ncores</argument>
		<argument type="string" mandatory="no" default="all" values="all|none|movecontainer">objkey_filter</argument>
    </args>
</operator>
