<?xml version="1.0" encoding="UTF-8"?>
<!DOCTYPE operator SYSTEM "ophidiaoperator.dtd">
<operator name="OPH_CLUSTER" version="1.0">
    <info>
        <abstract>[Type]
Management.

[Behaviour]
Start, stop and get information about clusters of I/O servers.

[Parameters]
- action : use one of the following types:
	&quot;info&quot;: get information about clusters deployed by the user (default);
	&quot;info_cluster&quot;: get information about all the clusters (reserved to administrators);
	&quot;deploy&quot;: try to reserve hosts and starts I/O servers;
	&quot;undeploy&quot;: stop reservation and I/O servers.
- nhost : number of hosts to be reserved as well as number of I/O servers to be started over them.
- ndbms : number of I/O servers to be started over each host; default value is 1.
- host_partition : name of user-defined partition to be used to group hosts.
                   It needs to be set in case of &quot;deploy&quot; or &quot;undeploy&quot;.
- host_type : type of partition to be deployed; valid only in case of deployment:
              io : partition with I/O nodes (default);
              compute : partition with I/O nodes.
- user_filter : filter on username in case action &quot;info_cluster&quot; is selected (reserved to administrators).

[System parameters]
- exec_mode : operator execution mode. Possible values are async (default) for
              asynchronous mode, sync for synchronous mode with json-compliant output.
- objkey_filter : filter on the output of the operator written to file (default=all => no filter, none => no output):
                  cluster_summary : show cluster status, reserved hosts and available resources;
                  cluster_list : show cluster list;
                  cluster_list_summary : show cluster list summary;
                  cluster_user : show cluster user list (reserved to administrators);
                  cluster_user_summary : show cluster user list summary (reserved to administrators).
- save : set to &quot;yes&quot; (default) in case output has to be saved remotely.

[Examples]       
Start 3 I/O servers:
OPH_TERM: oph_cluster action=deploy;nhost=3;host_partition=cluster;
SUBMISSION STRING: &quot;operator=oph_cluster;action=deploy;nhost=3;host_partition=cluster;&quot;</abstract>
        <author>CMCC Foundation</author>
        <category>Administration</category>
        <creationdate>16/03/2018</creationdate>
        <license url="http://www.gnu.org/licenses/gpl.txt">GPLv3</license>
        <permission>read</permission>
    </info>
    <args>
		<argument type="string" mandatory="no" default="async" values="async|sync">exec_mode</argument>
		<argument type="string" mandatory="no" default="all">host_partition</argument>
		<argument type="string" mandatory="no" default="info" values="info|info_cluster|deploy|undeploy">action</argument>
		<argument type="int" mandatory="no" minvalue="0" default="0">nhost</argument>
		<argument type="int" mandatory="no" minvalue="1" default="1">ndbms</argument>
		<argument type="string" mandatory="no" default="all">user_filter</argument>
		<argument type="string" mandatory="no" default="io" values="io|compute">host_type</argument>
		<argument type="string" mandatory="no" default="all" values="all|none|cluster_summary|cluster_list|cluster_list_summary|cluster_user|cluster_user_summary">objkey_filter</argument>
		<argument type="string" mandatory="no" default="yes" values="yes|no">save</argument>
    </args>
</operator>
