<?xml version="1.0" encoding="UTF-8"?>
<!DOCTYPE operator SYSTEM "ophidiaoperator.dtd">
<operator name="OPH_DELETECONTAINER" version="1.0">
    <info>
        <abstract>[Type]
Data Process.

[Behaviour]
It removes a container with related dimensions and grids. The container can be deleted logically or physically.

[Parameters]
- container : name of the input container.
- cwd : absolute path corresponding to the current working directory
- force : flag used to force the removal of a non-empy container.
          Note that with &quot;yes&quot; all datacubes inside the container will be deleted,
          whereas with &quot;no&quot; (default) the container will be removed only if it is already empty.
- container_pid : PID of the input container. If it is set, &apos;container&apos; and &apos;cwd&apos; are negleted.

[System parameters]    
- exec_mode : operator execution mode. Possible values are async (default) for
              asynchronous mode, sync for synchronous mode with json-compliant output.
- ncores : number of parallel processes to be used (min. 1).
           This operator is not parallel, so the only possible value is 1.
- nthreads : maximum number of parallel threads to be used (min. 1). Used only when the force argument is set to &quot;yes&quot; 
- sessionid : session identifier used server-side to manage sessions and jobs.
              Usually users don't need to use/modify it, except when it is necessary
              to create a new session or switch to another one.
- objkey_filter : filter on the output of the operator written to file (default=all => no filter, none => no output).
                  deletecontainer : no output.
        
[Examples]       
Logically remove the empty visible container &quot;container1&quot; :
OPH_TERM: oph_deletecontainer container=container1;cwd=/session-code;
SUBMISSION STRING: &quot;operator=oph_deletecontainer;container=container1;cwd=/session-code;&quot;</abstract>
        <author>CMCC Foundation</author>
        <category>Virtual File System</category>
        <creationdate>27/07/2013</creationdate>
        <license url="http://www.gnu.org/licenses/gpl.txt">GPLv3</license>
        <permission>write</permission>
    </info>
    <args>
		<argument type="string" mandatory="yes">container</argument>
		<argument type="string" mandatory="yes">cwd</argument>
		<argument type="string" mandatory="no" default="-">container_pid</argument>
		<argument type="string" mandatory="no" default="no" values="yes|no">force</argument>
		<argument type="string" mandatory="no" default="async" values="async|sync">exec_mode</argument>
		<argument type="string" mandatory="no" default="null">sessionid</argument>
		<argument type="int" mandatory="no" default="1" minvalue="1" maxvalue="1">ncores</argument>
		<argument type="int" mandatory="no" default="1" minvalue="1">nthreads</argument>
		<argument type="string" mandatory="no" default="all" values="all|none|deletecontainer">objkey_filter</argument>
    </args>
</operator>

