<?xml version="1.0" encoding="UTF-8"?>
<!DOCTYPE operator SYSTEM "ophidiaoperator.dtd">
<operator name="OPH_GET_CONFIG" version="1.0">
    <info>
        <abstract>[Type]
Metadata Access

[Behaviour]
Request the configuration parameters.

[Parameters]
- key : name of the metadata to be request.

[System parameters]
- objkey_filter : filter on the output of the operator written to file (default=all => no filter, none => no output).
                  get_config : show config data as text.
        
[Examples]       
Get the URL where XML documents associated with Ophidia operators are located:
OPH_TERM: oph_get_config key=OPH_XML_URL;
SUBMISSION STRING: &quot;operator=oph_get_config;key=OPH_XML_URL;&quot;</abstract>
        <author>CMCC Foundation</author>
        <creationdate>09/03/2014</creationdate>
        <license url="http://www.gnu.org/licenses/gpl.txt">GPLv3</license>
	<permission>read</permission>
    </info>
    <args>
		<argument type="string" mandatory="no" default="all" values="all|OPH_XML_URL|OPH_SESSION_ID|OPH_EXEC_MODE|OPH_NCORES|OPH_DATACUBE|OPH_CWD|OPH_CDD|OPH_BASE_SRC_PATH">key</argument>
		<argument type="string" mandatory="no" default="all" values="all|none|get_config">objkey_filter</argument>
    </args>
</operator>
