<?xml version="1.0" encoding="UTF-8"?>
<!DOCTYPE operator SYSTEM "ophidiaoperator.dtd">
<operator name="OPH_RANDCUBE2" version="1.0">
    <info>
        <abstract>[Type]
Data Process.
        	
[Behaviour]
It creates a new datacube with random data and dimensions. Works only with Ophidia I/O server.

[Parameters]
- cwd : absolute path corresponding to the current working directory.
- host_partition : name of I/O host partition used to store data. By default the first available host partition will be used.
- ioserver : type of I/O server used to store data.
             Only possible values is: &quot;ophidiaio_memory&quot; (default)
- schedule : scheduling algorithm. The only possible value is 0,
		   for a static linear block distribution of resources.
- nhost : number of output hosts. With default value (&apos;0&apos;) all host available in the host partition are used.
- nfrag : number of fragments per database.
- ntuple : number of tuples per fragment.
- run : If set to &apos;no&apos; the operator simulates the creation and computes the fragmentation parameters 
		that would be used, else if set to &apos;yes&apos; the actual cube creation is executed.
- measure : name of the measure used in the datacube.
- measure_type : type of measures. Possible values are &quot;double&quot;, &quot;float&quot; or &quot;int&quot;
- exp_ndim : used to specify how many dimensions in dim argument, starting from the first one,
				 must be considered as explicit dimensions. NOTE: the new datacube must have at least 
				one implicit dimension, hence the total number of dimensions is bigger or equal 
				than exp_ndim +1.
- dim: name of the dimension. 
				Multiple-value field: list of dimensions separated by &quot;|&quot; can be provided  
- concept_level: concept level short name (must be a single char). Default value is &quot;c&quot;
				Multiple-value field: list of concept levels separated by &quot;|&quot; can be provided. 
- dim_size: size of random dimension.
				Multiple-value field: list of dimension sizes separated by &quot;|&quot; can be provided. 
- compressed : if set to &quot;yes&quot;, new data will be compressed.
			 With &quot;no&quot; (default), data will be inserted without compression.
- grid: optional argument used to identify the grid of dimensions to be used (if the grid already exists) 
             or the one to be created (if the grid has a new name). If it isn't specified, no grid will be used.
- description : additional description to be associated with the output cube.
- output_path : optional folder where the output cube will be stored; by default the cube is saved in current working directory.
- algorithm : it can be used to specify the type of emulation schema used to generate data. By default values are sampled indipendently from a uniform distribution in the range [0, 1000]. If "temperatures" is used, then values are generated with a first order auto-regressive model to be consistent with temperature values (in Celsius).
- dim_type: types of the dimensions. Default value is &quot;double&quot; for all the dimensions.
            Multiple-value field: list of types separated by &quot;|&quot; can be provided.
- hierarchy: concept hierarchy name of the dimensions. Default value is &quot;oph_base&quot;
             Multiple-value field: list of concept hierarchies separated by &quot;|&quot; can be provided, the explicit dimensions first.
- vocabulary: optional argument used to indicate a vocabulary (name of set of keys) to be associated with metadata.
- base_time: in case of time hierarchy, it indicates the base time of the dimension. Default value is 1900-01-01.
- units: in case of time hierarchy, it indicates the units of the dimension. Possible values are: s, m, h, 3, 6, d.
- calendar: in case of time hierarchy, it indicates the calendar type. Possible values are:
            -- standard (default)
            -- gregorian
            -- proleptic_gregorian
            -- julian
            -- 360_day
            -- no_leap
            -- all_leap
            -- user_defined
- month_lengths: in case of time dimension and user-defined calendar, it indicates the sizes of each month in days.
                 There must be 12 positive integers separated by commas. Default is &apos;31,28,31,30,31,30,31,31,30,31,30,31&apos;.
- leap_year: in case of time dimension and user-defined calendar, it indicates the first leap year. By default it is set to 0.
- leap_month: in case of time dimension and user-defined calendar, it indicates the leap month. By default it is set to 2 (i.e. February).
- policy : rule to select how data are distribuited over hosts:
           -- &apos;rr&apos; hosts are ordered on the basis of the number of cubes stored by it (default);
           -- &apos;port&apos; hosts are ordered on the basis of port number.
     
[System parameters]
- exec_mode : operator execution mode. Possible values are async (default) for
              asynchronous mode, sync for synchronous mode with json-compliant output.
- ncores : number of parallel processes to be used (min. 1).       
- nthreads : number of parallel threads per process to be used (min. 1).
- sessionid : session identifier used server-side to manage sessions and jobs.
              Usually users don't need to use/modify it, except when it is necessary
              to create a new session or switch to another one.
- objkey_filter : filter on the output of the operator written to file (default=all => no filter, none => no output).
                  randcube : show operator's output PID as text in case "run" is "yes", else the parameter check is shown.

[Examples]
Generate a random compressed data cube with 1 host, 8 fragments/db, 10 tuples/fragment, 10 elements/tuple
with &apos;pressure&apos; measure and &apos;lat&apos;, &apos;lon&apos; and &apos;time&apos; dimensions:
OPH_TERM: oph_randcube2 nhost=1;nfrag=8;ntuple=10;measure=Pressure;measure_type=double;exp_ndim=2;dim=lat|lon|time;concept_level=c|c|d;dim_size=16|10|10;compressed=yes;
SUBMISSION STRING: &quot;operator=oph_randcube2;nhost=1;nfrag=8;ntuple=10;measure=Pressure;measure_type=double;exp_ndim=2;dim=lat|lon|time;concept_level=c|c|d;dim_size=16|10|10;compressed=yes;&quot;</abstract>
        <author>CMCC Foundation</author>
        <category>Data Import/Export</category>
        <creationdate>04/10/2018</creationdate>
        <license url="http://www.gnu.org/licenses/gpl.txt">GPLv3</license>
        <permission>write</permission>
    </info>
    <args>
		<argument type="string" mandatory="no" default="null">sessionid</argument>
		<argument type="int" mandatory="no" default="1" minvalue="1">ncores</argument>
		<argument type="int" mandatory="no" default="1" minvalue="1">nthreads</argument>
		<argument type="string" mandatory="no" default="async" values="async|sync">exec_mode</argument>
		<argument type="string" mandatory="yes">cwd</argument>
		<argument type="string" mandatory="no" default="auto">host_partition</argument>
		<argument type="string" mandatory="no" default="ophidiaio_memory" values="ophidiaio_memory">ioserver</argument>
		<argument type="int" mandatory="no" default="0" values="0">schedule</argument>
		<argument type="int" mandatory="no" minvalue="0" default="0">nhost</argument>
		<argument type="string" mandatory="no" default="yes" values="yes|no">run</argument>
		<argument type="int" mandatory="yes" minvalue="1">nfrag</argument>
		<argument type="int" mandatory="yes" minvalue="1">ntuple</argument>
		<argument type="string" mandatory="yes">measure</argument>
		<argument type="string" mandatory="yes" values="double|float|int|long|short|byte">measure_type</argument>
		<argument type="int" mandatory="yes" minvalue="1">exp_ndim</argument>
		<argument type="string" mandatory="yes" multivalue="yes">dim</argument>
		<argument type="string" mandatory="no" default="c" multivalue="yes">concept_level</argument>
		<argument type="string" mandatory="yes" multivalue="yes">dim_size</argument>
		<argument type="string" mandatory="no" default="no" values="yes|no">compressed</argument>
		<argument type="string" mandatory="no" default="-">grid</argument>
		<argument type="string" mandatory="no" default="-">description</argument>
		<argument type="string" mandatory="no" default="-">output_path</argument>
		<argument type="string" mandatory="no" default="double" values="double|float|int|long|short|byte" multivalue="yes">dim_type</argument>
		<argument type="string" mandatory="no" default="oph_base" multivalue="yes">hierarchy</argument>
		<argument type="string" mandatory="no" default="CF">vocabulary</argument>
		<argument type="string" mandatory="no" default="1900-01-01 00:00:00">base_time</argument>
		<argument type="string" mandatory="no" default="d" values="s|m|h|3|6|d">units</argument>
		<argument type="string" mandatory="no" default="standard" values="standard|gregorian|proleptic_gregorian|julian|360_day|no_leap|all_leap|user_defined">calendar</argument>
		<argument type="string" mandatory="no" default="31,28,31,30,31,30,31,31,30,31,30,31">month_lengths</argument>
		<argument type="int" mandatory="no" default="0" minvalue="0">leap_year</argument>
		<argument type="int" mandatory="no" default="2" minvalue="1" maxvalue="12">leap_month</argument>
		<argument type="string" mandatory="no" default="rr" values="rr|port">policy</argument>
		<argument type="string" mandatory="no" default="all" values="all|none|randcube2">objkey_filter</argument>
		<argument type="string" mandatory="no" default="default" values="default|temperatures">algorithm</argument>
    </args>
</operator>
