<?xml version="1.0" encoding="UTF-8"?>
<!DOCTYPE operator SYSTEM "ophidiaoperator.dtd">
<operator name="OPH_CREATECONTAINER" version="1.0">
    <info>
        <abstract>[Type]
Data Process.

[Behaviour]
It creates an empty container.

[Parameters]
- container : name of the output container. It must be unique among folders and visible containers within the same parent folder.
- cwd : absolute path corresponding to the current working directory,
        used to select the folder where the container will be created.
- dim: names of the dimensions allowed. Multiple-value field: list of dimensions separated by &quot;|&quot; can be provided.
- dim_type: types of the dimensions. Default value is &quot;double&quot; for all the dimensions.
            Multiple-value field: list of types separated by &quot;|&quot; can be provided.
- hierarchy: concept hierarchy name of the dimensions. Default value is &quot;oph_base&quot;
             Multiple-value field: list of concept hierarchies separated by &quot;|&quot; can be provided.
- base_time: in case of time hierarchy, it indicates the base time of the dimension. Default value is 1900-01-01.
- units: in case of time hierarchy, it indicates the units of the dimension. Possible values are: s, m, h, 3, 6, d.
- calendar: in case of time hierarchy, it indicates the calendar type. Possible values are:
            -- standard (default)
            -- gregorian
            -- proleptic_gregorian
            -- julian
            -- 360_day
            -- 365_day
            -- 366_day
            -- no_leap (equivalent to 365_day)
            -- all_leap  (equivalent to 366_day)
            -- user_defined
- month_lengths: in case of time dimension and user-defined calendar, it indicates the sizes of each month in days.
            There must be 12 positive integers separated by commas. Default is &apos;31,28,31,30,31,30,31,31,30,31,30,31&apos;.
- leap_year: in case of time dimension and user-defined calendar, it indicates the first leap year. By default it is set to 0.
- leap_month: in case of time dimension and user-defined calendar, it indicates the leap month. By default it is set to 2 (i.e. February).
- vocabulary: optional argument used to indicate a vocabulary (name of set of keys) to be used 
			  to associate metadata to the container.
- compressed : if &quot;yes&quot;, new data will be compressed.
			   With &quot;no&quot; (default), data will be inserted without compression.
- description : additional description to be associated with the output container.

[System parameters]    
- exec_mode : operator execution mode. Possible values are async (default) for
              asynchronous mode, sync for synchronous mode with json-compliant output.
- ncores : number of parallel processes to be used (min. 1).
           This operator is not parallel, so the only possible value is 1.
- sessionid : session identifier used server-side to manage sessions and jobs.
              Usually users don't need to use/modify it, except when it is necessary
              to create a new session or switch to another one.
- objkey_filter : filter on the output of the operator written to file (default=all => no filter, none => no output).
                  createcontainer : show operator's output PID as text.

[Examples]       
Create a new container &apos;container1&apos; with dimensions lat, lon and time into folder &apos;/folder&apos;:
OPH_TERM:: oph_createcontainer container=container1;cwd=/folder;dim=lat|lon|time;dim_type=double|double|double;hierarchy=oph_base|oph_base|oph_time;
SUBMISSION STRING: &quot;operator=oph_createcontainer;container=container1;cwd=/session-code1;dim=lat|lon|time;dim_type=double|double|double;hierarchy=oph_base|oph_base|oph_time;&quot;</abstract>
        <author>CMCC Foundation</author>
        <category>Virtual File System</category>
        <creationdate>24/09/2013</creationdate>
        <license url="http://www.gnu.org/licenses/gpl.txt">GPLv3</license>
        <permission>write</permission>
    </info>
    <args>
		<argument type="string" mandatory="no" default="null">sessionid</argument>
		<argument type="int" mandatory="no" default="1" minvalue="1" maxvalue="1">ncores</argument>
		<argument type="string" mandatory="no" default="async" values="async|sync">exec_mode</argument>
		<argument type="string" mandatory="yes">container</argument>
		<argument type="string" mandatory="yes">cwd</argument>
		<argument type="string" mandatory="yes" multivalue="yes">dim</argument>
		<argument type="string" mandatory="no" default="double" values="double|float|int|long|short|byte" multivalue="yes">dim_type</argument>
		<argument type="string" mandatory="no" default="oph_base" multivalue="yes">hierarchy</argument>
		<argument type="string" mandatory="no" default="1900-01-01 00:00:00">base_time</argument>
		<argument type="string" mandatory="no" default="d" values="s|m|h|3|6|d">units</argument>
		<argument type="string" mandatory="no" default="standard" values="standard|gregorian|proleptic_gregorian|julian|360_day|365_day|366_day|no_leap|all_leap|user_defined">calendar</argument>
		<argument type="string" mandatory="no" default="31,28,31,30,31,30,31,31,30,31,30,31">month_lengths</argument>
		<argument type="int" mandatory="no" default="0" minvalue="0">leap_year</argument>
		<argument type="int" mandatory="no" default="2" minvalue="1" maxvalue="12">leap_month</argument>
		<argument type="string" mandatory="no" default="CF">vocabulary</argument>
		<argument type="string" mandatory="no" default="no" values="yes|no">compressed</argument>
		<argument type="string" mandatory="no" default="-">description</argument>
		<argument type="string" mandatory="no" default="all" values="all|none|createcontainer">objkey_filter</argument>
    </args>
</operator>
