<?xml version="1.0" encoding="UTF-8"?>
<!DOCTYPE operator SYSTEM "ophidiaoperator.dtd">
<operator name="OPH_SHOWGRID" version="1.0">
    <info>
        <abstract>[Type]
Metadata Access.
            
[Behaviour]
It shows information about one or more grids related to the specified container.
            
[Parameters]
- container : name of the input container.
- grid : name of grid to show. With no name all grids are shown.
- dim : name of dimensions to show.
                   Multiple-value field: list of dimensions separated by &quot;|&quot; can be provided.
                   If not specified all dimensions are shown.
- show_index : if &quot;no&quot; (default), it won&apos;t show dimension ids.
               With &quot;yes&quot;, it will also show the dimension id next to the value.
- cwd : absolute path corresponding to the current working directory,
        necessary to correctly parse paths.
        All resolved paths must be associated to the calling session,
        so they should contain &quot;/&lt;session-code&gt;&quot;.
            
[System parameters]    
- exec_mode : operator execution mode. Possible values are async (default) for
              asynchronous mode, sync for synchronous mode with json-compliant output.
- ncores : number of parallel processes to be used (min. 1).
            This operator is not parallel, so the only possible value is 1.
- sessionid : session identifier used server-side to manage sessions and jobs.
             Usually users don't need to use/modify it, except when it is necessary
             to create a new session or switch to another one.
- objkey_filter : filter on the output of the operator written to file (default=all => no filter, none => no output).
                  showgrid_diminfo : show the list of the dimensions associated with a container.
		  showgrid_dimvalues : show the values of the dimensions associated with a container.
		  showgrid_tip : show a help message.
            
[Examples]
Show the grid &apos;grid1&apos; related to container &apos;container1&apos; :
OPH_TERM: oph_showgrid container=container1;grid=grid1;cwd=/session-code1;
SUBMISSION STRING: &quot;operator=oph_showgrid;container=container1;grid=grid1;cwd=/session-code1;&quot;</abstract>
        <author>CMCC Foundation</author>
        <category>Metadata</category>
        <creationdate>06/12/2013</creationdate>
        <license url="http://www.gnu.org/licenses/gpl.txt">GPLv3</license>
        <permission>read</permission>
    </info>
    <args>
		<argument type="string" mandatory="yes">container</argument>
		<argument type="string" mandatory="no" default="all">grid</argument>
		<argument type="string" mandatory="no" default="all">dim</argument>
		<argument type="string" mandatory="no" default="no" values="yes|no">show_index</argument>
		<argument type="string" mandatory="yes">cwd</argument>
		<argument type="string" mandatory="no" default="async" values="async|sync">exec_mode</argument>
		<argument type="string" mandatory="no" default="null">sessionid</argument>
		<argument type="int" mandatory="no" default="1" minvalue="1" maxvalue="1">ncores</argument>
		<argument type="string" mandatory="no" default="all" values="all|none|showgrid_diminfo|showgrid_dimvalues|showgrid_tip">objkey_filter</argument>
    </args>
</operator>
