<?xml version="1.0" encoding="UTF-8"?>
<!DOCTYPE operator SYSTEM "ophidiaoperator.dtd">
<operator name="OPH_CUBESIZE" version="1.0">
    <info>
        <abstract>[Type]
Metadata Access.

[Behaviour]
It computes and displays the size of the input datacube.

[Parameters]
- cube : name of the input datacube. The name must be in PID format.
- schedule : scheduling algorithm. The only possible value is 0,
		     for a static linear block distribution of resources.
- byte_unit : measure unit used to show datacube size. The unit can be KB, 
            MB (default), GB, TB or PB
- algorithm : algorithm used to compute the size. Possible values are:
		        &quot;eurisitic&quot; (default) to estimate the size with an euristic method; 
              &quot;count&quot; to get the actual size of each fragment.


[System parameters]    
- exec_mode : operator execution mode. Possible values are async (default) for
              asynchronous mode, sync for synchronous mode with json-compliant output.
- ncores : number of parallel processes to be used (min. 1).
- sessionid : session identifier used server-side to manage sessions and jobs.
              Usually users don't need to use/modify it, except when it is necessary
              to create a new session or switch to another one.
- objkey_filter : filter on the output of the operator written to file (default=all => no filter, none => no output).
                  cubesize : show cube size.

[Examples]
Compute the size of the datacube &quot;http://www.example.com/1/1&quot; :
OPH_TERM: oph_cubesize cube=http://www.example.com/1/1;
SUBMISSION STRING: &quot;operator=oph_cubesize;cube=http://www.example.com/1/1;&quot;</abstract>
        <author>CMCC Foundation</author>
        <category>Metadata</category>
        <creationdate>27/07/2013</creationdate>
        <license url="http://www.gnu.org/licenses/gpl.txt">GPLv3</license>
        <permission>read</permission>
    </info>
    <args>
		<argument type="string" mandatory="yes" multivalue="yes">cube</argument>
		<argument type="int" mandatory="no" default="0" minvalue="0" maxvalue="0" values="0">schedule</argument>
		<argument type="string" mandatory="no" default="async" values="async|sync">exec_mode</argument>
		<argument type="string" mandatory="no" default="MB" values="KB|MB|GB|TB|PB">byte_unit</argument>
		<argument type="string" mandatory="no" default="euristic" values="euristic|count">algorithm</argument>
		<argument type="string" mandatory="no" default="null">sessionid</argument>
		<argument type="int" mandatory="no" default="1" minvalue="1">ncores</argument>
		<argument type="string" mandatory="no" default="all" values="all|none|cubesize">objkey_filter</argument>
    </args>
</operator>
