<?xml version="1.0" encoding="UTF-8"?>
<!DOCTYPE operator SYSTEM "ophidiaoperator.dtd">
<operator name="OPH_SEARCH" version="1.0">
    <info>
        <abstract>[Type]
Metadata Access.

[Behaviour]
It provides enhanced searching on metadata.
 
[Parameters]
- container_filter : zero, one or more filters on containers' names.
                     Filters could be any type of search string accepted by SQL,
                     with wildcards, OR-ed with pipes (filter1|filter2|...).
                     Mute this filter with the default value &quot;all&quot;.                  
- metadata_key_filter : zero, one or more filters on metadata keys.
                        Filters could be any type of search string accepted by SQL,
                        with wildcards, OR-ed with pipes (filter1|filter2|...).
                        Mute this filter with the default value &quot;all&quot;.                 
- metadata_value_filter : zero, one or more filters on metadata values.
                          Filters could be any type of search string accepted by SQL,
                          with wildcards, OR-ed with pipes (filter1|filter2|...).
                          Mute this filter with the default value &quot;all&quot;.
- path : absolute/relative path used as the starting point of the recursive search.
         If not specified or in case of &quot;-&quot; (default) the recursive search will start at the cwd.
- cwd : absolute path corresponding to the current working directory, necessary to correctly parse paths.
- recursive : specifies if the search is done recursively or not. 
              The argument is considered only for the first three levels and may have the following values:
              -- no : research only in current path (default)
              -- yes : research recursively starting from current path.

[System parameters]
- exec_mode : operator execution mode. Possible values are async (default) for
              asynchronous mode, sync for synchronous mode with json-compliant output.
- ncores : number of parallel processes to be used (min. 1).
            This operator is not parallel, so the only possible value is 1.
- sessionid : session identifier used server-side to manage sessions and jobs.
               Usually users don't need to use/modify it, except when it is necessary
               to create a new session or switch to another one.
- objkey_filter : filter on the output of the operator written to file (default=all => no filter, none => no output).
                  search : show metadata list.
 
 [Examples]       
 Get metadata with keys starting with &quot;key&quot; and values starting with &quot;http&quot; through a recursive search starting from &quot;/absolute/path&quot; :
 OPH_TERM: oph_search metadata_key_filter=key%;metadata_value_filter=http%;cwd=/absolute/path;
 SUBMISSION STRING: &quot;operator=oph_search;metadata_key_filter=key%;metadata_value_filter=http%;cwd=/absolute/path;&quot;</abstract>
        <author>CMCC Foundation</author>
        <category>Metadata</category>
        <creationdate>13/10/2013</creationdate>
        <license url="http://www.gnu.org/licenses/gpl.txt">GPLv3</license>
        <permission>read</permission>
    </info>
    <args>
		<argument type="string" mandatory="no" default="all" multivalue="yes">container_filter</argument>
		<argument type="string" mandatory="no" default="all" multivalue="yes">metadata_key_filter</argument>
		<argument type="string" mandatory="no" default="all" multivalue="yes">metadata_value_filter</argument>
		<argument type="string" mandatory="no" default="-">path</argument>
		<argument type="string" mandatory="yes">cwd</argument>
		<argument type="string" mandatory="no" default="no" values="yes|no">recursive</argument>
		<argument type="string" mandatory="no" default="async" values="async|sync">exec_mode</argument>
		<argument type="string" mandatory="no" default="null">sessionid</argument>
		<argument type="int" mandatory="no" default="1" minvalue="1" maxvalue="1">ncores</argument>
		<argument type="string" mandatory="no" default="all" values="all|none|search">objkey_filter</argument>
    </args>
</operator>
